post_id	post_text
129011692114_10153615426097115	Secondary 4 student Claire Teo Jing Qi responds to a previous Forum letter, says there is no justification for sexual assault, no matter what a person wears or does. "(Outdated notions) are no longer applicable to today\'s society," says the 16-year-old. Do you agree? Should modesty be considered when picking an outfit to wear?
129011692114_10153615437732115	Cracked trains: Why weren\'t the hairline cracks made public? str.sg/45oa
129011692114_10153615441552115	All new MRT trains assembled by a Chinese rolling stock company in Qingdao, not just the 26 defective ones, will have a key component cast in Japan instead of China.
129011692114_10153615457117115	"Such a drastic measure also smacks of a siege mentality, and the quality of life here will be unnecessarily affected," says Forum letter writer Seah Yam Meng
129011692114_10153615465667115	According to the report, the average Singaporean now starts saving for retirement at 32 and continues for another 29 years.
129011692114_10153615488917115	StanChart robbery: Notebook contained the phrases Canadian citizen David James Roach, 26, had written on a slip of paper. "This is a robbery, I have a weapon, give me money, don\'t call police."
129011692114_10153615528927115	If tensions ratchet up, regional states will have to determine for themselves to what extent they want to be involved in such efforts.
129011692114_10153615544557115	Chinese entomologist discovers beetle which eats rotten wood, names it after China president Xi Jinping in recognition for his anti-corruption efforts. But the censors are not amused.
129011692114_10153615557172115	Fewer wedding bells rang and more couples split up during #SG50.
129011692114_10153615568537115	Indonesian prosecutors had demanded that Singaporean Choo Chiau Huat (right) be jailed for two years, fined 1.5 billion rupiah (S$154,000) and have his vessel destroyed.
129011692114_10153615577257115	Telecommunications, media and technology have overtaken financial services in Temasek\'s portfolio. But taking bets in the tech sector entails higher risk.
129011692114_10153615582682115	ST GRAPHIC: E-wallet services have encountered adoption speed bumps, with users worrying about card security. str.sg/45Jo
129011692114_10153615582817115	Starbucks is increasing the price of its espressos and lattes by 10 to 30 cents in the US. http://str.sg/453e
129011692114_10153615583037115	When watching The Secret Life Of Pets, what better way than to do it with your dog by your side? http://str.sg/453m
129011692114_10153615583967115	"I intend to do everything I can to make certain she will be the next president of the United States," said Sanders at a rally with Clinton. http://str.sg/453k
129011692114_10153615584362115	With earnings amounting to US$170 million (S$229 million) last year, pop singer Taylor Swift has become the world\'s highest-paid celebrity. http://str.sg/45JB
129011692114_10153615588372115	Three bloody deaths in three days.
129011692114_10153615595052115	The lies of former wife of alleged match-fixing czar Dan Tan did not hinder investigations, says judge.
129011692114_10153615603117115	In My Paper ??: Starting next month, more than 100 eateries in Seoul\'s Jongno district will offer discounts to customers who turn up in the traditional Korean attire. The area is popular with tourists. http://str.sg/45JJ
129011692114_10153615639702115	The three bought the vaporisers overseas and sold them on social media and e-commerce platforms to 23 buyers.
129011692114_10153615644432115	Han Seok Yeong kicked the cabby\'s arm while he was driving, then attacked him again after he stopped and called the police.
129011692114_10153615646727115	NDP 2016: Over 150 special needs participants from seven voluntary welfare organisations will perform songs including What a Wonderful World as well as NDP favourites such as Home. http://str.sg/45Jg ST VIDEO: SEOW BEI YI
129011692114_10153615650437115	"He put on some lipstick and later walked away as a woman accompanied by his wife and their two children," said a Jakarta police spokesman.
129011692114_10153615664502115	The two were arrested for driving at 170kmh in a 50kmh zone, more than three times the speed limit.
129011692114_10153615667187115	NDP2016: The show segment will feature a futuristic display that involves a glimmering unicorn, LED costumes and a giant sky city prop. http://str.sg/45Jg ST VIDEO: SEOW BEI YI
129011692114_10153615702487115	PSLE changes from 2021: T-score to be replaced by 8 grade bands called Achievement Levels (AL); pupils currently in Pri 1 cohort first to be graded under new system. Priority for Sec 1 admissions to be given to students who put the school higher in choice order in case of tie. Do you have questions on the latest PSLE changes? AskSandra at askST@sph.com.sg
129011692114_10153615707802115	Pupils in Pri 1 this year will be the first cohort to be graded under the new PSLE system. Here are 7 things that will be different in 2021. Do you have questions on the latest PSLE changes? AskSandra at askST@sph.com.sg
129011692114_10153615714012115	Want to win a pair of National Day Parade tickets, preview tickets or funpacks? Here\'s how: Share with us three original pictures that respectively depict Singapores past, present and future, and tell us in 51 words or less how they represent your wishes for the country. You may draw or use your own photos, and focus on any facet of Singapore from fashion and food, to schools and playgrounds. Upload them on Instagram with the hashtag #myfuturesg by July 18. str.sg/4iTK Good luck!
129011692114_10153615740567115	A police officer in Kansas who left a threatening comment on a Facebook picture of a young African-American girl was fired from his job. But that hasn\'t made the girl\'s mother feel any safer. More videos at www.straitstimes.com
129011692114_10153615748107115	WATCH: What are the changes made to the PSLE scoring system, and what it means for pupils who will be sitting for the exams from 2021 http://str.sg/45JD Do you have questions on the latest PSLE changes? AskSandra at askST@sph.com.sg VIDEO: MINISTRY OF EDUCATION
129011692114_10153615775172115	PSLE changes: Here\'s what\'s different between the current T-score system and the new system in 2021: http://str.sg/45JD Do you have questions on the latest PSLE changes? AskSandra at askST@sph.com.sg
129011692114_10153615798182115	From 1960, when pupils were only told if they passed or failed, to the new Achievement Level system in 2021 - here\'s how the PSLE has changed. Do you have questions on the latest PSLE changes? AskSandra at askST@sph.com.sg
129011692114_10153615819577115	MOE answers 10 questions that you might have about the PSLE changes. Do you have any other questions? AskSandra at askST@sph.com.sg
129011692114_10153615829587115	Will the new PSLE system effect a change? ST\'s senior education correspondent Sandra Davie asks parents. Do you have questions on the latest PSLE changes? AskSandra at askST@sph.com.sg
129011692114_10153615842087115	The FBI is ending investigations on the strange case of "DB Cooper", who hijacked a plane 45 years ago, collected the ransom money, then parachuted away. No sign of him was ever found. http://str.sg/453N
129011692114_10153615848812115	"Please note that this is not created or endorsed by FairPrice and we advise our customers to be wary of such campaigns," said NTUC FairPrice.
129011692114_10153615887997115	The 82-year-old emperor expressed his intention to step down "in a few years", but no reason was cited for the decision.
129011692114_10153615930707115	During the rape trial, Muhammad Firman Jumali Chew, 30, claimed that the girl had sexually violated him while he looked at the ceiling with his arms by his side.
129011692114_10153615937862115	Got a minute? Here are three of today\'s top local news stories: http://str.sg/453i
129011692114_10153616002017115	Sulikah, 27, also admitted that she had previously been told off by Madam Ng\'s children for treating her roughly, but started abusing her again because she got frustrated when taking care of her.
129011692114_10153616043692115	She was still unaware of her son\'s arrest when a reporter contacted her early on Wednesday.
129011692114_10153616077097115	Several hygiene lapses, including failure to maintain temperature records and allowing an unregistered food handler to prepare food, were observed during inspections.
129011692114_10153616119807115	Mr Lee\'s 4-day trip to Mongolia marks the first official visit by a Singapore prime minister to the landlocked country, which lies between Russia and China.
129011692114_10153616164347115	"To get into the top band, your child needs to score nine out of 10, or a near perfect score. The margin for error is razor thin," pointed out ST\'s deputy business editor Aaron Low. He has two sons who will come under the new PSLE system.
129011692114_10153616186652115	Here\'s what you need to know about Achievement Levels, the new system of scoring and how Sec 1 admissions are affected by the PSLE changes. http://str.sg/45JD Do you have questions on the latest PSLE changes? AskSandra at askST@sph.com.sg
129011692114_10153616214522115	The free apps - which can be downloaded via the Apple App Store or Google Play - are AsiaOne, Berita Harian, Lianhe Wanbao, Lianhe Zaobao, The Business Times, The Straits Times, ONE FM91.3, Kiss92 and UFM100.3.
129011692114_10153616236192115	Officers found 15 cartons of cigarettes in the car\'s engine compartment.
129011692114_10153616274882115	"Changing the PSLE grading system will not change my mind about hiring tutors. This is also chiefly because Singapore\'s secondary school admission is still based on scores," ST\'s digital editor Irene Tham wrote. Her daughter is among the first batch affected by the PSLE changes.
129011692114_10153616314142115	The total prize money has doubled, with the winner now getting $25,000 and each of the three other finalists $5,000 each.
129011692114_10153616337697115	JUST IN: Body of missing boatman from burning bumboat near Esplanade has been found, says SCDF. http://str.sg/4536
129011692114_10153616377347115	The Spellbound tour, her first regional undertaking, had kicked off in Singapore in June last year following her high-profile stint on the popular China television competition I Am A Singer.
129011692114_10153616490827115	Officials say the nine-year-old cat will survive the upcoming Cabinet reshuffle.
129011692114_10153616506557115	David Cameron exits, Theresa May enters as Britain\'s new prime minister. http://str.sg/453K
129011692114_10153617227577115	Theresa May has replaced David Cameron as Britain\'s prime minister. http://str.sg/45ih And her first tasked shocked the political sphere - she appointed former London Mayor Boris Johnson, the "Leave" campaign figurehead in Britain\'s EU referendum, foreign secretary.
129011692114_10153617228292115	Top story today, July 14: New PSLE scoring system to have 8 grade bands Also in the news: David Cameron quits as British PM, paves way for Theresa May More on straitstimes.com
129011692114_10153617296592115	The body of the boatman has been identified as 33-year-old Mr Ong Hock Long. He was on his way to pick up passengers from the Esplanade stop when the blaze broke out.
129011692114_10153617395237115	The current PSLE system allows pupils to pull up their T-scores by scoring between 90 to 100 in subjects they are strong in. Now, such high marks will get them the same Achievement Level (AL) 1 score.
129011692114_10153617417572115	Singapore\'s economy grew by 2.2% in the second quarter of this year, marginally higher than the 2.1% expansion in the first quarter, according to advance estimates from MTI.
129011692114_10153617468797115	Finer bands at the top will help to differentiate students at these levels, while the middle to lower bands are "sufficient to give a good indication of a student\'s progress", according to MOE.
129011692114_10153617472927115	JUST IN: 34 restaurants and hawker stalls earn Bib Gourmand distinction in inaugural Michelin Guide Singapore. The Bib Gourmand restaurants are those which serve quality food at affordable prices (not more than $45). See the full list of restaurants and hawkers stalls on our live blog here. http://str.sg/45i8
129011692114_10153617503657115	Several hygiene lapses that were observed by the NEA and AVA include a failure to maintain temperature records and allowing an unregistered food handler to prepare food.
129011692114_10153617552337115	By using words like "routine", the Transport Ministry risks giving some the impression that it is taking a serious problem lightly, says ST\'s Transport correspondent Christopher Tan.
129011692114_10153617583627115	Gotta catch \'em all: Users who install the game using unofficial installation files run the risk of being exposed to malware.
129011692114_10153617631857115	SINGAPORE MICHELIN GUIDE: Song Fa Bak Kut Teh in New Bridge Road, Tian Tian Chicken Rice at Maxwell Road Food Centre and Balestier Road Hoover Rojak at Whampoa Market Place, just some of the stalls that were given the Bib Gourmand award.
129011692114_10153617653897115	Trump\'s potential running mates are Indiana Governor Mike Pence, New Jersey Governor Chris Christie and former speaker of the House Newt Gingrich.
129011692114_10153617665487115	SINGAPORE MICHELIN GUIDE: "Very happy and surprised that a small little hawker stall like us can make the list", says Ms Grace Tay from Chey Sua Carrot Cake. Her stall is located at Block 127 Toa Payoh Lor 1 #02-30. http://str.sg/45iH
129011692114_10153617725107115	PM Lee Hsien Loong inspects the honour guards during his visit to Mongolia. Mr Lee is on a four-day visit and will be attending the Asia-Europe Meeting Summit on Friday and Saturday. http://str.sg/45iv
129011692114_10153617743522115	Vice-Foreign Minister Liu Zhenmin said China had "the right" to establish an ADIZ over the sea. However, the nation will not turn the South China Sea into a source of war.
129011692114_10153617816367115	A look back on past cases of accidents involving pedestrians and tips on how to ensure their safety on the road.
129011692114_10153617825827115	Heading out for lunch? How about checking out the Bib Gourmand list. We have the details.
129011692114_10153617833877115	BrandInsider sponsored series: The 21.5km North-South Corridor, due to be completed in 2020, will have dedicated cycling and pedestrian pathways linking Woodlands directly to the city centre. http://str.sg/455G
129011692114_10153617840472115	JUST IN: The Singapore Exchange\'s securities market has temporarily ceased trading as at 11.38AM. "Further details will be provided in the next update. We apologise for any inconvenience caused", says SGX.
129011692114_10153617876147115	The Competition Commission of Singapore is investigating a complaint alleging that several companies were refusing to supply lift spare parts for the maintenance and servicing of lifts in HDB estates.
129011692114_10153617898232115	"If you\'re so fed up with having your body judged, stop trying to make it look so Photoshop-perfect on magazine covers", wrote Piers Morgan after Aniston slammed the media for body shaming her.
129011692114_10153617969887115	UPDATE: SGX says securities trading expected to resume at 2pm, technical issues the cause for the halt in trading. LATEST UPDATE: SGX will not resume trading at 2pm as earlier announced. Resumption will only begin "once member reconciliation is completed", they said in a tweet.
129011692114_10153618027612115	OPINION: The Hague ruling is likely to have an impact on the development of a rules-based order for the oceans whether or not it is strictly complied with by the parties in the case, writes Robert Beckman For The Straits Times.
129011692114_10153618123122115	Sponsored content: After establishing itself as a manufacturer of memory modules, local firm Strontium realised growth was stagnating and it was time to venture into new markets. #SgGoesGlobal
129011692114_10153618151252115	Seventeen hawker stalls, 14 restaurants and three street food establishments have been given the Bib Gourmand award in the inaugural Michelin Guide Singapore. Here\'s the full list of the 34 eateries that have been singled out for providing quality food at affordable prices. str.sg/455T
129011692114_10153618160587115	The 10-year-old girl did not sense anything amiss when her uncle started cuddling her. He then sexually assaulted her and stopped only after the girl cried out in pain.
129011692114_10153618243997115	In My Paper ??: Liam Neeson, who takes on the role of US General Douglas MacArthur in Korean war flick Operation Chromite, describes his first experience filming with an all-Korean crew "mind-blowing". http://str.sg/455h
129011692114_10153618324292115	What are the pros and cons of removing the retirement age here? Will this help older workers stay in the workforce?
129011692114_10153618360157115	Looking for good, affordable food options? Why not try one of the 17 hawker stalls that made it to the Bib Gourmand list? http://str.sg/45S2
129011692114_10153618404177115	UPDATE: The Singapore Exchange said it would not be reopening today, after earlier saying trading might resume at 4pm.
129011692114_10153618412867115	He may not have the easily recognisable hairstyles of other politicians like Donald Trump or Boris Johnson, but French President Francois Hollande does have a hairdresser - who\'s paid 9,895 euros a month. http://str.sg/45Sn
129011692114_10153618413477115	Meet New Zealand\'s "chillest chip shop owner", Said Ahmed, who calmly handed a customer his order while ignoring a bewildered robber, before walking away to call the police. http://str.sg/45Se
129011692114_10153618414282115	Pokemon Go may be one of the world\'s most popular games, but a spokesman from the Auschwitz Museum is asking trainers to refrain from playing it on the grounds of the former concentration camp. http://str.sg/45Sm
129011692114_10153618418212115	Students in India\'s Jharkand state were seen going through notes and copying each other\'s answers during an exam, but according to their teacher, none of them were cheating. http://str.sg/45SZ
129011692114_10153618419212115	#ICYMI: Former British PM David Cameron gave his farewell speech to parliament on Wednesday to a round of ovation, handing the reins of power over to Theresa May. http://str.sg/45SW
129011692114_10153618443797115	"It is absolutely not true," Vice-Grand Steward Shinichiro Yamamoto of the Imperial Household Agency told media.
129011692114_10153618479642115	Currently, Singaporeans will need a visa if they intend to in Mongolia for more than 14 days.
129011692114_10153618508692115	Turkish kebabs and rib-eye steak, laksa, chicken rice and crispy curry puffs: These are just some of the dishes on the menu of the 34 restaurants and hawker stalls on the Bib Gourmand list: http://str.sg/455y Anyone hungry yet?
129011692114_10153618512427115	Making up the top five after SIA were messaging app WhatsApp, Apple\'s iPhone, Facebook and clothing chain Uniqlo.
129011692114_10153618564417115	Former Malaysian PM Mahathir Mohamad said his new party would look to form a coalition with the opposition, but that he would not contest the polls.
129011692114_10153618608242115	OPINION: Without clear jurisdiction, the tribunal simply has no rights to even arbitrate the case, let alone fundamentally deny China\'s rights, write Wang Wen and Chen Xiaochen For The Straits Times.
129011692114_10153618630907115	Got a minute? Here are three of today\'s top local news stories: http://str.sg/45ST
129011692114_10153618750767115	The crane had seemingly tipped over onto its side, crushing the cab of a lorry and injuring two people, who were sent to hospital.
129011692114_10153618790772115	The importer of Pakary Haw Balls is recalling the product, after a member of the public found a "small plastic chip" in one of the bottles.
129011692114_10153618798872115	Who needs wheels when you\'ve got wings? These teenagers aren\'t old enough to drive, but have the training and qualification to take planes up in the air. http://str.sg/45Sg
129011692114_10153618820892115	Singapore River Cruise said it was extending financial assistance to the boatman\'s family, and has told its employees to speak up if they had concerns or were emotionally upset by the accident.
129011692114_10153618836107115	The two have been identified as Jim Harper and Danielle Bremner, who are allegedly responsible for a string of vandalisms across Asia.
129011692114_10153618884777115	Goh Kee Yong targeted accounts that were inactive and withdrew a total of $336,850 in cash from four of them. He was found out when one of the account owners noticed the unauthorised transactions.
129011692114_10153618928307115	OPINION: Rather than issue a strongly worded statement against China, Manila will likely use the tribunal ruling to revive long-frayed bilateral ties and seek tangible concessions on the ground, writes Richard Javad Heydarian For The Straits Times.
129011692114_10153618956547115	While many politicians congratulated Boris Johnson on the appointment, newspapers and social media were not as kind, treating it as the latest act in a political theatre of the absurd.
129011692114_10153618998992115	The graphic novel, which retells Singapore\'s path to nationhood, beat out other books such as Jeremy Tiang\'s It Never Rains On National Day and Mohamed Latiff Mohamed\'s The Widower, which was translated by Alfian Sa\'at.
129011692114_10153619018277115	End-2018 was the time for "probable formal departure" from the EU, said Mr David Davis, the newly appointed Secretary of State for Exiting the European Union.
129011692114_10153619034962115	Police managed to rescue five people who were "attached with chains and straps... beaten (and) humiliated", starved of food and fed on scraps.
129011692114_10153619093122115	Teo Boon Tiak used fake documents such as a birth certificate and an identity card to get the passport.
129011692114_10153619389752115	The show faces competition from House Of Cards, Better Call Saul, Mr Robot, Downton Abbey, The Americans and Homeland. http://str.sg/45TJ
129011692114_10153619392657115	Terry remains a firm favourite with the club\'s fans. http://str.sg/45T3
129011692114_10153619397302115	He\'s a conservative with the potential to unify divided Republicans. http://str.sg/45TU
129011692114_10153619399707115	"Because the virus is unable to infect the same person twice - thanks to the immune system generating antibodies to kill it - the epidemic reaches a stage where there are too few people left to infect for transmission to be sustained." http://str.sg/45Tw
129011692114_10153619785232115	BREAKING: Dozens reported dead, up to 100 injured. Authorities treating incident as an attack, say reports. http://str.sg/45cC
129011692114_10153619831787115	Top story today, July 15: SGX\'s longest trading halt raises concern Also in the news: 5 suppliers of spare parts of HDB lifts under probe More on straitstimes.com
129011692114_10153619868857115	Branding him a liar, a coward or a joker, Europe\'s political class greets Eurosceptic Boris Johnson\'s appointment as Britain\'s foreign minister with a chorus of dismay. http://str.sg/45cF Meanwhile, researchers say the outbreak of the mosquito-borne Zika virus, blamed for a surge in birth defects, should be over within three years.
129011692114_10153619977472115	StanChart robbery: "Wear plain clothes, take a taxi and behave normally," suspect David Roach wrote on one page of his notebook. In another, he scribbled: "Make money."
129011692114_10153620004907115	"I can understand the fear; I cannot get my head around the stigma part," Britain\'s Prince Harry said. "Twenty years ago, I could understand it, but now?" The 31-year-old\'s test came back negative.
129011692114_10153620045907115	Yesterday\'s downtime of five hours 20 minutes was the first major disruption since two outages that outraged investors in late 2014.
129011692114_10153620049842115	Attack on Nice, France - White truck seen driving at high speed onto famed Promenade des Anglais after annual Bastille Day celebration display - At least 73 people killed - Local authorities are treating the incident as an attack - Driver of the truck reportedly killed and an accomplice on the run
129011692114_10153620086282115	$32 million lawsuit by residents of The Seaview condominium settled out of court.
129011692114_10153620090007115	In a five-page letter to parents yesterday, the school said: "The management believes that the teacher is deemed fit to continue teaching at Zoo-phonics School (Serangoon)."
129011692114_10153620110952115	SGX reopens trading on local securities market on Friday morning. STI jumps at open, up to 0.7 per cent. Glitch attributed to technology issue affecting trade confirmation processes.
129011692114_10153620152262115	The fast-speed train will get travellers from Singapore to Kuala Lumpur in 90 minutes, compared with more than four hours by car.
129011692114_10153620158272115	The five suppliers allegedly refused to supply vital parts such as motherboards to third-party lift maintenance contractors here.
129011692114_10153620166377115	"During the campaign he lied a lot to the British people and now it is he who has his back to the wall," says French Foreign Minister Jean-Marc Ayrault. "I need a partner with whom I can negotiate and who is clear, credible and reliable."
129011692114_10153620172862115	"I told all my staff to eat the chicken rice; I myself ate it, too, and until now, there have not been any problems," says Pow Sing boss Lee Chin Soo.
129011692114_10153620196792115	Malaysia police are probing the warning about a possible attack in Malacca. #ICYMI
