post_id	post_text
125845680811480_1157831110946260	Back home! On both days at #ASEM, we awoke to shocking news - the terror attack in Nice and attempted coup in Turkey. Both resulted in many lives lost. A stark reminder of a troubled world, and why in Singapore we must stay united and look out for one another. Our MFA is watching the situation in Turkey closely. For overseas Singaporeans, wherever you may be, please e-register with MFA (https://eregister.mfa.gov.sg/) and stay safe. LHL
125845680811480_1158332397562798	Enjoyed this song by Singapore talents ??? the Freshman written for ??? (The Provision Shop), a telemovie directed by Royston Tan ???. I played the OST (official sound track) twice - first to absorb the lyrics, then to enjoy the images! The telemovie aired on Channel 8 last night. It explores tensions between locals and foreigners in our communities, and has attracted interest and discussion. I hope to watch it soon. Here it is with English subtitles: youtu.be/i-Sj7M-7a-Y LHL ???????????????????????????????????????????????????????????????????????????????????? http://bit.ly/29Mdz0N?????? ???????????????????????????????????????? youtu.be/i-Sj7M-7a-Y ??????? ???
125845680811480_1158537847542253	A sentimental wefie. My old CO, LTC Chan Cheow Nam (on my left), was in town, so I had tea with him and his family, and our old artillery comrades. We had a good time reminiscing about the old days - it is more than 40 years since I served under LTC Chan in 24 SA, as Survey Platoon Commander. We also naturally caught up with how each other\'s families are doing - quite a few are full time grandfathers! - LHL (Photo by me)
125845680811480_1158987164163988	Delighted that former President SR Nathan was honoured with the Outstanding Member of the South Asian Diaspora (OMSAD) 2016 Award at the South Asian Diaspora Convention (SADC) last night. Mr Nathan was not only an outstanding Singaporean, but contributed much to the global South Asian community. In fact, the SADC was first mooted by Mr Nathan, as a platform for Singapore to network with prominent members of the South Asian diaspora. After the award presentation, I had an interesting dialogue where we discussed the effects of globalisation, India-China relations, Indias potential, and other issues. You can watch the full dialogue session here: http://bit.ly/29QwjgS LHL
125845680811480_1159321397463898	Heres my speech from the joint press conference held during the HSR Memorandum of Understanding Signing Ceremony. - LHL (PMO Video by Alex Qiu)
125845680811480_1159550824107622	Caught up with PM Najib Razak over lunch before witnessing the signing of the Memorandum of Understanding on our High Speed Rail (HSR) in Putrajaya this afternoon. PM Najib and I agreed to build the HSR between KL and Singapore three years ago (bit.ly/29PWwem). Since then our officials have worked hard and long, through several Ramadans and Rayas, to reach agreement on key issues. The HSR is a massive, long-term investment. Good execution will be crucial. We need to work closely together on many joint decisions and implementation issues. PM Najib and I will give full attention to this, because we want this major project to be done right. With the HSR, people will think of Singapore-KL the same way as they think of London-Paris, Seoul-Busan, Taipei-Kaohsiung, Shanghai-Nanjing, or Tokyo-Osaka. If all goes well, the first trains will start running around 2026, just 10 years from now! - LHL
125845680811480_1159946060734765	There is an old proverb: measure twice, cut once. Building and Construction Authority (Singapore) (BCA) has put a new spin on that, with Build Twice: First Virtual, Then Real. :) Saw firsthand this morning how BCA is rolling out new technologies to build greener, more environmentally sustainable buildings. One of them is the Skylab, a rotating structure built atop the new Academic Tower at the BCA Academy. It is fitted with over 200 sensors. The structure can be rotated, to position the sun and wind at different angles. Designers and researchers use it to test strategies for lighting, cooling and ventilating a building which use less energy. LHL
125845680811480_1160302494032455	Happy Racial Harmony Day! Harmony between our different races and religions is a fundamental principle of our nation. We celebrate our diversity, and share each others customs and cultures. Unfortunately, in many countries, we are seeing more cases where people reject diversity and inclusion. Just look at the extremist terrorist attacks in recent weeks - Orlando in the US, Dhaka in Bangladesh, Nice in France, Puchong in Malaysia - each incident chilling, driven by hatred, and heartbreaking. In Singapore, we must always stay united as one people, and never allow any such event to break or divide us. LHL [Young ones attending school in colourful ethnic costumes to celebrate Racial Harmony Day. / ST Photo © Singapore Press Holdings Limited. Reproduced with permission.]
125845680811480_1160571570672214	Came across this music video by Liang Wenfu, commissioned for the launch of Lianhe Zaobao\'s new look. For a language to stay alive, it needs to be part of our daily life. Zaobaos makeover aims to make the Chinese language and news more accessible to its readers, and encourage interest in and use of Chinese. If you wish to improve your Chinese, do take a look at the new Zaobao. You will surely find something that interests you. - LHL ????????????????????????????????? ????????????????????????????????????????:) ? ??? #zb #?????
125845680811480_1161184287277609	Attended Mr Chor Yeok Engs wake today. Mr Chor belonged to the Pioneer Generation who built Singapore. He dedicated his life to the country and to improving the lives of Singaporeans. As a young man, he joined the PAP to fight for an independent Singapore. As MP for Bukit Timah, he saw the poor neighbourhood turn into a beautiful modern estate, and improved the lives of residents. Mr Chors integrity and character shone on many occasions. In 1956, when a 2,000 strong mob threatened to burn down the former Yeo Hiap Seng factory in Bukit Timah, he stopped them. He reminded them that they were against the colonialists and not the local manufacturer. Mr Lee Kuan Yew considered Mr Chor one of his oldest, most steadfast and courageous party comrades. He said that if he had to choose one other to go to battle with him, he would pick Mr Chor. After retiring in 1984, Mr Chor kept a watchful eye over his old constituency. I often met him when I visited Bukit Timah for constituency events, and was glad to see him again last year when we celebrated the 60th Anniversary of Bukit Timah. I would like to express my deepest condolences to Mr Chors family at this time of sorrow. LHL (Speaking to Mr Chor at the 60th Anniversary of Bukit Timah celebrations last year. / MCI Photo by Chwee.)
125845680811480_1161632200566151	Shocked to learn of the shootings in #Munich last night. Singapore condemns this senseless act. We have seen so many brutal terrorist attacks in recent months, one after another. We are at risk of becoming numbed, and have to remind ourselves of the terrible human tragedy each time. Our thoughts are with the people of Germany during this time and our deep condolences to the families of the victims. - LHL
125845680811480_1162191427176895	Took a wefie with the exuberant Dikir Barat performers from Yio Chu Kang Community Club last night. They put up an exciting show, at the Hari Raya celebrations for residents young and old of Ang Mo Kio GRC and Sengkang West SMC. Heartened to see residents of all races joining in and celebrating with their Malay friends. Many families turned up in beautiful matching baju kurung - it was a very colourful sight! :). In a troubled world, such occasions remind us how precious the harmony we enjoy in Singapore is. Selamat Hari Raya Aidilfitri to all! - LHL ========== Mengambil "wefie" bersama kumpulan Dikir Barat dari Kelab Masyarakat Yio Chu Kang malam tadi. Persembahan mereka untuk penduduk GRC Ang Mo Kio dan SMC Sengkang West sungguh bertenaga dan menarik sekali. Saya gembira melihat penduduk berbilang kaum bersuka ria meraikan perayaan Mustika Aidilfitri ini bersama rakan-rakan Melayu kita. Seronok melihat banyak keluarga yang datang mengenakan baju kurung sedondon. Mereka kelihatan cantik sekali - sungguh berwarna-warni! Sedang kita menyaksikan dunia yang semakin kocar-kacir, majlis sebegini mengingatkan kita betapa berharganya keharmonian yang kita nikmati di Singapura. Selamat Hari Raya Aidilfitri! - LHL (MCI Photo by Chwee)
125845680811480_1162462620483109	Joined my fellow Ang Mo Kio Town Council MPs for a dialogue with residents this morning. (The Town Council includes AMK GRC and Sengkang West SMC.) Heard their feedback and updated them on the Ang Mo Kio-Sengkang West 2.0 Masterplan unveiled last year (bit.ly/2a4tMg5). We have made progress. The first phase of Ang Mo Kio as a cycling town has been completed (bit.ly/2a4IqUv). Other projects on the way include more Home Improvement Programmes, a new polyclinic, a nursing home, pre-schools, Family Service Centres, and the Lentor MRT Station on the Thomson Line. With our residents support and the hard work of the Town Council and partners, Ang Mo Kios development under the Masterplan will be completed as envisioned. - LHL
125845680811480_1162851957110842	Rounded out my Sunday celebrating Jalan Kayu Day with Dr Intan Mokhtar and her residents. We launched the HOME@JK initiative, which helps low-income Jalan Kayu residents retrofit their homes. The scheme provides essential upgrades such as wheelchair-friendly fittings, or even a new coat of paint, to make the homes more comfortable to live in. Events like Jalan Kayu Day are a great way to bring residents together. But after the carnivals and games are over, it is the day-to-day ways we look after each other that make a community great. Happy to see a strong community spirit in Jalan Kayu! LHL
125845680811480_1164218173640887	MCI Photo by Terence Tan
125845680811480_1164220086974029	Two weeks to National Day! Many happy and excited students have already caught a sneak peek of the NDP during the National Education Shows at the National Stadium. - LHL (MCI Photo by Terence Tan)
125845680811480_1165130923549612	Denise Phua Lay Peng shared this heartwarming music video with me. It stars The Harvard Din & Tonics, a Harvard University a capella group. They will be performing at A Very Special Walk (AVSW) this Saturday, 30 July at the Enabling Village. This annual fundraising event is in support of the Autism Resource Centre Singapore / Pathlight School. With community support, people with autism can lead fulfilling and independent lives, just like you and me. May this video will inspire you to stand by people with autism, and their caregivers too! :) LHL
125845680811480_1165961813466523	Singaporean Zulfikar Mohamad Shariff has been arrested and detained under the Internal Security Act for terrorism-related activities. Zulfikar used social media to propagate radical ideology, glorify ISIS, and exhort Muslims to take up arms and wage militant jihad. Zulfikar also helped to radicalise at least two other Singaporeans. He aimed to provoke Singapore Muslims to push for an Islamic state to replace our democratic system. Fortunately, our security agencies caught him before he could do more harm. Such extremist, violent beliefs have no place in our multi-racial and multi-religious country. The government will be alert to spot such individuals, but we need everyones help to uphold and protect our harmonious way of life. Together, we can stay united and strong. - LHL
125845680811480_1166430030086368	You are never too old learn new things and these graduates from The People\'s Association Senior Academy are the best example of that! The youngest graduate at yesterdays convocation was only 51! PA launched the Senior Academy last year to encourage seniors to pursue lifelong learning. Yesterdays graduates had completed a four-month long Certificate in Senior Wellness programme. The modules included Smartphone 101, Canvas Art, and even K-pop Line Dancing. The programme has been very popular and PA has just launched the Advanced Certificate in Senior Wellness. Now, seniors can enjoy deeper learning and at the same time, make new friends. Congratulations to the Class of 2016! May you continue to pursue your interests and passions. Age is nothing but a number, especially if you are young at heart. ;) LHL ????????????! ???????????????????????????????????????????? ??????????????????????????????????????????????????????? ?????? ???????????????????????? ?????????????????????????????????????????????????????????????????????????????????????? ???
125845680811480_1167105150018856	Thank you to all who performed and contributed to the Teck Ghee Fundraising Concert last night at the Esplanade-Theatres on the Bay! The $370,000 raised will go a long way to support our needy and underprivileged residents. The performances were mainly by Teck Ghee residents, old and young. The items were chosen from a talentime competition that we held. They were thrilled to have a chance to perform at the Esplanade and practised hard. The result was a very good show enjoyed by all. Weve got lots of talent, if only we know where to look, and can persuade people not to be shy! At Narita Airport now waiting for my connecting flight. Will update with photos when I arrive in DC! LHL
125845680811480_1167209943341710	PM Lee is making an official visit to the US from 31 July to 5 August at the invitation of President Obama. The visit affirms Singapores longstanding close partnership with the US and coincides with the 50th anniversary of diplomatic relations. Heres a quick look at SG-US relations ahead of PMs visit! #SGUS50 (PMO Video by Chiez How / Photos by MCI, MINDEF, National Archives Singapore, Singapore American School and PM Lee)
125845680811480_1167399036656134	On my way to Washington DC. Saddened to learn while flying about Mr SR Nathans stroke and his grave condition. Have been in touch with his family. Mr Nathan served as our Ambassador to the US in the 1990s, among many contributions in a long career. He made many good friends for Singapore, and planted many seeds, including this beautiful antique Littleleaf Japanese Maple at our Washington DC embassy. We have him in our thoughts and prayers. - LHL (MCI Photo by Kenji Soon)
125845680811480_1168159383246766	A good first day in Washington DC. Checked in at Blair House, the US Presidents Guest House, after landing at Dulles Airport. Then to our Embassy for an early National Day celebration with overseas Singaporeans. This trip is short but significant. The United States is one of our most important partners, and it is an honour to be invited here by President Obama to mark the longstanding friendship between our countries. We have close ties in trade, defence and many other areas. I look forward to meeting several US Cabinet members tomorrow to see how we can do more together. - LHL
125845680811480_1168776879851683	Had productive meetings with US Treasury Secretary Jack Lew, Secretary of Defense Ash Carter and Secretary of Commerce Penny Pritzker on my second day in DC. Their portfolios - economy, defence and trade - are all pillars of our strong ties with the United States. I talked about the Trans-Pacific Partnership with all three, because the TPP is not just about trade, but has major strategic benefits. We also signed an MOU to promote tech partnerships between infrastructure companies from both sides. Now preparing for the White House Arrival Ceremony. The event will be live streamed on my FB Page at about 9pm SG time. Do tune in and join me there! :) LHL #SGUS50
125845680811480_1168822256513812	Some highlights of my first two days in Washington DC. Photos of my visit can be viewed here bit.ly/2aG8WbA and bit.ly/2aoTcY3. - LHL (PMO Video by Alex Qiu and Chiez How)
125845680811480_1168829343179770	PM Lee Hsien Loong was welcomed by President Obama at the Arrival Ceremony at the White House in Washington DC.
125845680811480_1168835286512509	PM Lee will be attending the Arrival Ceremony at The White House shortly. The event will be live streamed here so stay tuned! UPDATE: The live stream has ended. Thanks for watching with us!
125845680811480_1169232856472752	Here\'s a 360 look at the State Dinner which PM Lee is attending! (PMO Photo)
125845680811480_1170106116385426	Capped off my US visit on Tuesday with a long fruitful day. Singapores first official visit was in 1967, when President Lyndon Johnson invited Mr Lee Kuan Yew to Washington DC. 50 years ago, we were newly independent, struggling to build a modern economy. America was divided over the Vietnam War. Mr Lee explained to the US why Asia mattered to America, and why their active engagement was crucial to the millions living in non-Communist countries in Southeast Asia. Today, thanks to US sacrifices and efforts, we live in a more peaceful, stable and prosperous region. Singapores relationship with the United States has flourished. We are partners in many areas - trade, defence, R&D, education, and are continually exploring ways to do more together. Most importantly, we enjoy strong people-to-people ties. So it is fitting that we are marking 50 years with a scholarship for student exchanges in each others countries. We have come far, and have many more things to do together. In Narita now, waiting for my flight home! LHL #SGUS50
125845680811480_1170137603048944	Some highlights from Tuesdays Arrival Ceremony and State Dinner at the White House. More photos can be viewed here: http://bit.ly/2aWdWqH. - LHL (PMO Video by Chiez How and Alex Qiu)
125845680811480_1170817516314286	Back home! Thank you to President Obama and First Lady Michelle Obama, Vice President Biden and Mrs Jill Biden, Secretary of State John Kerry and the many Americans who met and welcomed us so warmly and hospitably. It was a memorable visit indeed to mark the 50th anniversary of SG-US diplomatic relations. Special thanks also to the Blair House staff who hosted the Singapore delegation with tremendous warmth and thoughtfulness. Really appreciated the kitchen staff going the extra mile to prepare our delicious meals! :) - LHL #SGUS50 (MCI Photo by Terence Tan)
125845680811480_1171705682892136	At my joint press conference with President Obama in Washington on Tuesday, we were asked about the Trans-Pacific Partnership (TPP). I shared my perspective from this side of the Pacific. The TPP is a deal. It is the outcome of a tough bargaining process that all 12 member countries have negotiated. Each agreed to improve market access to the rest, and commit to a set of common rules, in exchange for the others doing the same. It is not just about exports but also about imports. It will benefit consumers as well as producers. Our people will enjoy a wider range of products, services, and opportunities that will improve their livelihoods. It also has a strategic dimension. It promotes interdependence instead of rivalry, and ultimately peace instead of war. President Obama has been critical in pushing for the TPP. The deal will not only benefit American workers and businesses. It will show clearly that America will stay engaged in the Asia Pacific, and deepen ties with its many friends and allies in the region. LHL
125845680811480_1172115616184476	Good morning :)! Time for a #guesswhere to start up your Sunday. - LHL (Photo by me)
125845680811480_1172377156158322	Delighted that Saiyidah Aisyah (Aisyah Rower), Singapores first Olympic rower, has qualified for the womens single sculls quarter-finals at #Rio2016! Its been an extraordinary journey to the Olympics for this Sport Singapore SPEX Scholar. Her next race will be on National Day, right about the time that the whole nation will be celebrating NDP at the National Stadium. Well all be roaring for you, Saiyidah! To all our Team Singapore athletes at the Olympics - your hard work, perseverance, and sacrifices are an inspiration to all. Do your best, and fly our flag high. We are all behind you! LHL #OneTeamSG
125845680811480_1172876796108358	Joined Darryl David and the residents of Ang Mo Kio-Hougang at their National Day Dinner last night. This is the first National Day after SG50. We were in a celebratory mood, but also conscious of the threats we face, particularly with the reports of terrorists being arrested in Batam. Glad to see so many residents taking part, waving flags and singing their favourite National Day songs. Thank you to the organisers, performers and volunteers for making this an enjoyable and meaningful event for all. LHL
129011692114_10153613652842115	Swedish furniture company Ikea Group is recalling 1.66 million chests and dressers in China. Ikea Singapore says its products are safe when anchored to a wall. str.sg/45os
129011692114_10153613667792115	Sharing your Netflix might be a Federal crime in the US. But it doesn\'t look like the video-streaming site sees it as an issue. More at www.straitstimes.com
129011692114_10153613670187115	The Beckhams are usually in front of the camera, but for Burberry\'s Brit fragrance campaign photoshoot in London, eldest son Brooklyn was the one taking pictures. http://str.sg/453h
129011692114_10153614906707115	Top story today, July 13: Tribunal rejects China\'s sea claims Also in the news: Khaw Boon Wan explains decision on MRT train cracks More on straitstimes.com
129011692114_10153615034482115	StanChart robbery: Canadian citizen David James Roach was arrested in a 12-bed mixed dormitory room in Bangkok. Here\'s what he did in the hours leading to the arrest.
129011692114_10153615051517115	StanChart robbery: Singaporean eyewitness staying at the same hostel said the suspect was quiet and introspective. He was always on his own and "never once talked or smiled" during his stay and "seemed to be in his own world", she added.
129011692114_10153615058722115	No cash, no cards, no problem? Deputy Tech Editor Trevor Tan attempts to spend a week paying for things with just his smartphone.
129011692114_10153615067902115	Preparing for the Primary 1 registration, but unsure about how best to proceed? ST Senior Education Correspondent Sandra Davie shares what she knows. Got a question for ST reporters? Email us at askST@sph.com.sg.
129011692114_10153615082302115	Singapore-based mixed martial art promoter One Championship lands deal with Temasek Holdings-led consortium. Partnership said to be worth \'significant eight-figure sum\'.
129011692114_10153615082427115	The 20-page maiden print issue focuses heavily on the significance of Ramadan and jihad.
129011692114_10153615102957115	The bilingual message in Chinese and English says the city\'s famous Jonker Street and Stadthuys are among the targets
129011692114_10153615107647115	UPDATE: Charred bumboat which caught fire yesterday docked at the Esplanade outdoor theatre at the Marina Bay on Wednesday morning. SCDF officers, as well as family members of the missing man, are at the scene. str.sg/45og
129011692114_10153615112612115	Give China a ladder to climb down from, says academic William Choong. "If they get humiliated publicly, which is happening now, and you rub salt in the wound by conducting military drills, you\'ll get a fierce reaction."
129011692114_10153615123092115	Man wearing a business suit and tie hijacked a plane in 1971. After it landed safely, he made away with US$200,000. The FBI, which has been after him ever since, says it will now drop the case.
129011692114_10153615170592115	Bumboat fire: PUB officers on boats at the Marina Bay on Wednesday morning. About three \'soft blasts\' were heard yesterday when the bumboat caught fire. A man is still missing. str.sg/45og
129011692114_10153615183397115	Dubai-based Emirates clinched the top honour for the fourth time, while Qatar Airways - which was first last year - slipped to second.
129011692114_10153615200497115	Three-month-old baby dies while being fed by her father, who was engrossed in a mobile phone game. Just two weeks before, she had suffered broken ribs and a fractured skull after being dropped by her father Mohamed Shiddiq Sazali. He had lied about the incident but subsequently failed a lie-detector test.
129011692114_10153615206857115	The rare contraction, coming on the back of a series of expansions, occurred as more car owners sought to extend the lifespan of their cars.
129011692114_10153615231027115	Malaysia\'s top terrorist-fighting cop Ayob Khan received the death threat through a phone call from the terrorist himself.
129011692114_10153615236962115	Bumboat fire: Underwater search for missing boatman called off, surface search resumes, says SCDF. str.sg/45oh
129011692114_10153615269392115	Is the highest-ranked school the right school for your child? Not always. Here\'s why.
129011692114_10153615335097115	He is among six bankers who are being investigated over BSI\'s ties to 1MDB. But that hasn\'t stopped the bank\'s former Asia chief Hanspeter Brunner from suing his employer over his frozen bonus.
129011692114_10153615369062115	Posts tagged as #WPSHugot was the fifth most trending topic on Twitter. The caption here says: "Your love life is like the nine-dash line - imaginary"
129011692114_10153615401447115	Bumboat fire: SCDF divers deploy boat next to the charred bumboat as the search continues. str.sg/45oh
129011692114_10153615417487115	Nine-year-old Elysia Laub was playing in her family\'s farm in Indiana, USA, when she found a newborn girl - with her umbilical cord and placenta still attached. More videos at www.straitstimes.com
